<?xml version="1.0" encoding="UTF-8"?>
<!--

Copyright (C) 2006 by OpenRAW (http://www.openraw.org)
======================================================

This file is licensed under a Creative Common License.
http://creativecommons.org/licenses/by-sa/2.5
======================================================

-->
<directory name="Minolta" xmlns:xsi="http://www.w3.org/2001/XMLSchema-instance"
    xsi:noNamespaceSchemaLocation="Directory.xsd">
    <tag>
        <code>0</code>
        <type>undefined</type>
        <length>4</length>
        <name>Block Descriptor</name>
        <example></example>
        <description></description>
    </tag>
    <tag>
        <code>1</code>
        <type>undefined</type>
        <length>99</length>
        <name>Camera Settings</name>
        <example></example>
        <description></description>
    </tag>
    <tag>
        <code>16</code>
        <type>undefined</type>
        <length>99</length>
        <name>Autofocus Related</name>
        <example></example>
        <description></description>
    </tag>
    <tag>
        <code>32</code>
        <type>undefined</type>
        <length>99</length>
        <name>Unknown</name>
        <example></example>
        <description></description>
    </tag>
    <tag>
        <code>64</code>
        <type>long</type>
        <length>1</length>
        <name>Raster Data Size</name>
        <example></example>
        <description></description>
    </tag>
    <tag>
        <code>129</code>
        <type>long</type>
        <length>1</length>
        <name>Thumbnail</name>
        <example></example>
        <description></description>
    </tag>
    <tag>
        <code>3584</code>
        <type>undefined</type>
        <length>40</length>
        <name>Epson PIM Info</name>
        <example></example>
        <description></description>
    </tag>
</directory>

