<?xml version="1.0" encoding="UTF-8"?>
<!--

Copyright (C) 2003-2008 by Fabrizio Giudici
======================================================

This file is licensed under a Creative Common License.
http://creativecommons.org/licenses/by-sa/2.5
======================================================

-->
<directory name="SonySRF" xmlns:xsi="http://www.w3.org/2001/XMLSchema-instance"
    xsi:noNamespaceSchemaLocation="Directory.xsd">
    <tag>
        <code>0</code>
        <type>long</type>
        <length>1</length>
        <name>SRF2 Key</name>
        <example></example>
        <description>The key needed for deciphering the SRF2 IFD.</description>
    </tag>
    <tag>
        <code>1</code>
        <type>long</type>
        <length>1</length>
        <name>Raster Key</name>
        <example></example>
        <description>The key needed for deciphering the raster data.</description>
    </tag>
    <tag>
        <code>4</code>
        <type>long</type>
        <length>1</length>
        <name>Raster Offset</name>
        <example></example>
        <description>The offset of raster data.</description>
    </tag>
    <tag>
        <code>5</code>
        <type>long</type>
        <length>1</length>
        <name>Raster Byte Count</name>
        <example></example>
        <description>The size of raster data in bytes.</description>
    </tag>
 </directory>

