<?xml version="1.0" encoding="UTF-8"?>
<!--

Copyright (C) 2003-2008 by Fabrizio Giudici
======================================================

This file is licensed under a Creative Common License.
http://creativecommons.org/licenses/by-sa/2.5
======================================================

-->
<directory name="Olympus" xmlns:xsi="http://www.w3.org/2001/XMLSchema-instance"
    xsi:noNamespaceSchemaLocation="Directory.xsd">
    <tag>
        <code>256</code>
        <type>undefined</type>
        <length>99</length>
        <name>JpegThumbnail</name>
        <example></example>
        <description></description>
    </tag>
    <tag>
        <code>512</code>
        <type>long</type>
        <length>3</length>
        <name>SpecialMode</name>
        <example></example>
        <description></description>
    </tag>
    <tag>
        <code>521</code>
        <type>undefined</type>
        <length>99</length>
        <name>CameraID</name>
        <example></example>
        <description></description>
    </tag>
    <tag>
        <code>8208</code>
        <type>int</type>
        <length>1</length>
        <name>Equipment</name>
        <example></example>
        <description></description>
    </tag>
    <tag>
        <code>8224</code>
        <type>int</type>
        <length>1</length>
        <name>CameraSettings</name>
        <example></example>
        <description></description>
    </tag>
    <tag>
        <code>8240</code>
        <type>int</type>
        <length>1</length>
        <name>RawDevelopment</name>
        <example></example>
        <description></description>
    </tag>
    <tag>
        <code>8256</code>
        <type>int</type>
        <length>1</length>
        <name>ImageProcessing</name>
        <example></example>
        <description></description>
    </tag>
    <tag>
        <code>8272</code>
        <type>int</type>
        <length>1</length>
        <name>FocusInfo</name>
        <example></example>
        <description></description>
    </tag>
</directory>

