<?xml version="1.0" encoding="UTF-8"?>
<!--

Copyright (C) 2003-2008 by Fabrizio Giudici
======================================================

This file is licensed under a Creative Common License.
http://creativecommons.org/licenses/by-sa/2.5
======================================================

-->
<directory name="Leica" xmlns:xsi="http://www.w3.org/2001/XMLSchema-instance"
    xsi:noNamespaceSchemaLocation="Directory.xsd">
    <tag>
        <code>1</code>
        <type>short</type>
        <length>1</length>
        <name>CompressionRate</name>
        <example></example>
        <description></description>
        <enumeration>
            <item>
                <value>2</value>
                <description>Low</description>
            </item>
            <item>
                <value>3</value>
                <description>Normal</description>
            </item>
            <item>
                <value>6</value>
                <description>Very low</description>
            </item>
            <item>
                <value>7</value>
                <description>Raw</description>
            </item>
            <item>
                <value>-1</value>
                <description>Unknown</description>
            </item>
        </enumeration>
    </tag>
    <tag>
        <code>3</code>
        <type>short</type>
        <length>1</length>
        <name>WhiteBalance</name>
        <example></example>
        <description></description>
        <enumeration>
            <item>
                <value>1</value>
                <description>Auto</description>
            </item>
            <item>
                <value>2</value>
                <description>Sunshine</description>
            </item>
            <item>
                <value>3</value>
                <description>Cloudy</description>
            </item>
            <item>
                <value>4</value>
                <description>Halogen</description>
            </item>
            <item>
                <value>5</value>
                <description>Manual</description>
            </item>
            <item>
                <value>8</value>
                <description>Electronic-Flash</description>
            </item>
            <item>
                <value>10</value>
                <description>Black-White</description>
            </item>
            <item>
                <value>-1</value>
                <description>Unknown</description>
            </item>
        </enumeration>
    </tag>
    <tag>
        <code>7</code>
        <type>short</type>
        <length>1</length>
        <name>FocusMode</name>
        <example></example>
        <description></description>
        <enumeration>
            <item>
                <value>1</value>
                <description>Auto</description>
            </item>
        </enumeration>
        <enumeration>
            <item>
                <value>2</value>
                <description>Manual</description>
            </item>
        </enumeration>
        <enumeration>
            <item>
                <value>-1</value>
                <description>Unknown</description>
            </item>
        </enumeration>
    </tag>
    <tag>
        <code>13</code>
        <type>short</type>
        <length></length>
        <name>LeikaWhiteBalance</name>
        <example></example>
        <description></description>
    </tag>
    <tag>
        <code>15</code>
        <type>short</type>
        <length>1</length>
        <name>Spot Autofocus</name>
        <example></example>
        <description></description>
        <enumeration>
            <item>
                <value>256</value>
                <description>On</description>
            </item>
            <item>
                <value>4096</value>
                <description>Off</description>
            </item>
            <item>
                <value>-1</value>
                <description>Unknown</description>
            </item>
        </enumeration>
    </tag>
    <tag>
        <code>28</code>
        <type>short</type>
        <length>1</length>
        <name>MacroMode</name>
        <example></example>
        <description></description>
    </tag>
    <tag>
        <code>31</code>
        <type>short</type>
        <length>1</length>
        <name>Aperture</name>
        <example></example>
        <description></description>
        <enumeration>
            <item>
                <value>6</value>
                <description>Auto</description>
            </item>
            <item>
                <value>7</value>
                <description>Manual</description>
            </item>
            <item>
                <value>-1</value>
                <description>Unknown</description>
            </item>
        </enumeration>
    </tag>
    <tag>
        <code>36</code>
        <type>short</type>
        <length>1</length>
        <name>FlashEV</name>
        <example></example>
        <description></description>
    </tag>
    <tag>
        <code>44</code>
        <type>short</type>
        <length>1</length>
        <name>Contrast</name>
        <example></example>
        <description></description>
        <enumeration>
            <item>
                <value>0x100</value>
                <description>Low</description>
            </item>
            <item>
                <value>0x110</value>
                <description>Standard</description>
            </item>
            <item>
                <value>0x120</value>
                <description>High</description>
            </item>
            <item>
                <value>-1</value>
                <description>Unknown</description>
            </item>
        </enumeration>
    </tag>
</directory>

