<?xml version="1.0" encoding="UTF-8"?>
<!--

Copyright (C) 2003-2008 by Fabrizio Giudici
======================================================

This file is licensed under a Creative Common License.
http://creativecommons.org/licenses/by-sa/2.5
======================================================

-->
<directory name="OlympusCameraSettings" xmlns:xsi="http://www.w3.org/2001/XMLSchema-instance"
    xsi:noNamespaceSchemaLocation="Directory.xsd">
    <tag>
        <code>257</code>
        <type>int</type>
        <length>1</length>
        <name>ThumbnailOffset</name>
        <example></example>
        <description></description>
    </tag>
    <tag>
        <code>258</code>
        <type>int</type>
        <length>1</length>
        <name>ThumbnailSize</name>
        <example></example>
        <description></description>
    </tag>
</directory>

