<?xml version="1.0" encoding="UTF-8"?>
<!--

Copyright (C) 2003-2008 by Fabrizio Giudici
======================================================

This file is licensed under a Creative Common License.
http://creativecommons.org/licenses/by-sa/2.5
======================================================

-->
<directory name="OlympusImageProcessing" xmlns:xsi="http://www.w3.org/2001/XMLSchema-instance"
    xsi:noNamespaceSchemaLocation="Directory.xsd">
    <tag>
        <code>256</code>
        <type>short</type>
        <length>2</length>
        <name>RBCoefficients</name>
        <example></example>
        <description></description>
    </tag>
    <tag>
        <code>1556</code>
        <type>int</type>
        <length>1</length>
        <name>ImageWidth</name>
        <example></example>
        <description>The width of the image for E-510</description>
    </tag>
    <tag>
        <code>1557</code>
        <type>int</type>
        <length>1</length>
        <name>ImageHeight</name>
        <example></example>
        <description>The height of the image for E-510</description>
    </tag>
</directory>

